{
	"inputs": [
		{
			"macro_type": "event",
			"event_type": "player_land",
			"macro": "Safe Land",
			"fire_mode": "once"
		},
		{
			"macro_type": "movement",
			"movement_type": "forward",
			"press_type": "hold",
			"delay": 0,
			"duration": 0,
			"id": 0
		},
		{
			"macro_type": "movement",
			"movement_type": "sprint",
			"press_type": "tap",
			"delay": 0,
			"duration": 0
		},
		{
			"macro_type": "movement",
			"movement_type": "jump",
			"press_type": "tap",
			"delay": 1,
			"duration": 0
		}
	],
	"name": "HH",
	"enabled": true,
	"trigger": "n"
}